Series_Title,Runtime_of_Series,Certificate,Runtime_of_Episodes,Genre,IMDB_Rating,Overview,Star1,Star2,Star3,Star4,No_of_Votes
CHiPs,(1977–1983),NA,60 min,"Crime, Drama, Mystery",6.4,The adventures of two California Highway Patrol motorcycle officers.,Larry Wilcox,Robert Pine,Paul Linke,NA,8177
Sweet Magnolias,(2020– ),NA,16,"Drama, Romance",7.4,"Centers on three South Carolina women, best friends since high school, as they shepherd each other through the complexities of romance, career, and family.",Brooke Elliott,Heather Headley,Carson Rowland,NA,8166
GCB,(2012),NA,430 min,"Comedy, Drama",7,"Amanda Vaughn is a recently widowed mother of two who, to get a fresh start, moves back to the affluent Dallas neighborhood where she grew up to find herself in the whirling midst of salacious gossip, Botox, and fraud.",Jennifer Aspen,Marisol Nichols,Miriam Shor,NA,8166
Angie Tribeca,(2016–2018),NA,30 min,"Action, Comedy, Crime",7,"Lone-wolf detective Angie Tribeca and a squad of committed LAPD detectives investigate the most serious cases, from the murder of a ventriloquist to a rash of baker suicides.",Jere Burns,Andree Vermeulen,Deon Cole,NA,8156
Father Brown,(2013– ),NA,52 min,"Crime, Drama, Mystery",7.7,Series inspired by the stories of GK Chesterton,Mark Williams,Sorcha Cusack,John Burton,Jack Deam,8151
Poyraz Karayel,(2015–2017),NA,123 min,"Action, Drama",8,"A defamed ex-cop, who is struggling to get back his son, is put on undercover duty within the biggest mafia in Istanbul.",Burçin Terzioglu,Musa Uzunlar,Ali Il,NA,8138
Ghost Adventures,(2008– ),NA,45 min,"Documentary, History, Reality-TV",7.5,"Zak Bagans, Aaron Goodwin, Billy Tolley, and Jay Wasley investigate the scariest, most notorious, haunted places in the world.",Aaron Goodwin,Billy Tolley,Jay Wasley,NA,8131
Kings,(2009),NA,60 min,"Drama, Sci-Fi",8.2,"A modern day, alternate-reality drama about a hero who rises to become the King of his nation, based on the biblical story of King David.",Christopher Egan,Susanna Thompson,Allison Miller,NA,8130
Jean-Claude Van Johnson,(2016–2017),NA,30 min,"Action, Comedy, Drama",7.6,Jean-Claude Van Damme has two lives: Damme as an actor and Johnson as a secret agent.,Moises Arias,Bar Paly,Tim Peper,NA,8122
Deception,(2018),13,41 min,"Crime, Drama, Mystery",7.5,A famed magician uses his skills of deception to assist the FBI in solving high-profile cases.,Jack Cutmore-Scott,Ilfenesh Hadera,Lenora Crichlow,Justin Chon,8122
Treadstone,(2019),16,44 min,Action,7,"The Treadstone project, having created super spy Jason Bourne, turns its attention on a new protocol to develop unstoppable superhuman assassins.",Jeremy Irvine,Tracy Ifeachor,Omar Metwally,Han Hyo-joo,8118
Mission: Impossible,(1966–1973),NA,50 min,"Action, Adventure, Crime",7.9,"An elite covert operations unit carries out highly sensitive missions subject to official denial in the event of failure, death or capture.",Barbara Bain,Greg Morris,Peter Lupus,NA,8112
Le Bureau des Légendes,(2015– ),NA,52 min,Drama,8.7,"After six years of undercover work in Syria, French intelligence officer Malotru returns home, where he struggles to forget his undercover identity, train a young recruit, and investigate when a colleague disappears in Algeria.",Florence Loiret Caille,Jonathan Zaccaï,Sara Giraudeau,NA,8102
About a Boy,(2014–2015),NA,22 min,"Comedy, Drama, Romance",7.4,"Womanizing Will lives a carefree bachelor life on a Christmas song's royalties - until 11 y.o. Marcus and his cute mom Fiona move in next door. Will provides an escape for Marcus from his vegan, hippie, uncool, depressed mom.",Benjamin Stockham,Al Madrigal,Minnie Driver,NA,8101
The Beverly Hillbillies,(1962–1971),NA,30 min,"Comedy, Family",7.2,A nouveau riche hillbilly family moves to Beverly Hills and shakes up the privileged society with their hayseed ways.,Donna Douglas,Irene Ryan,Max Baer Jr.,NA,8093
Crisis,(2014),NA,60 min,"Action, Drama, Thriller",7.2,"Centers on an idealistic Secret Service agent who finds himself at the center of an international crisis on his first day on the job. In his search for the truth, he will have to cross ...                See full summary »",Rachael Taylor,Lance Gross,James Lafferty,NA,8092
Clarissa Explains It All,(1991–1994),NA,30 min,"Comedy, Family",7.2,"As events unfold in her life, Clarissa explains to the viewer the motivations behind people's actions.",Jason Zimbler,Elizabeth Hess,Joe O'Connor,NA,8090
The Durrells,(2016–2019),NA,46 min,"Biography, Comedy, Drama",8.2,Based on the real-life events of the Durrell family as they resettle from England to Greece.,Josh O'Connor,Milo Parker,Daisy Waterstone,NA,8087
"What's New, Scooby-Doo?",(2002–2006),NA,30 min,"Animation, Adventure, Comedy",7.3,"Scooby-Doo and the Mystery, Inc. gang are launched into the 21st century, with new mysteries to solve.",Mindy Cohn,Casey Kasem,Arturo Mercado,NA,8042
Vicious,(2013–2016),NA,23 min,Comedy,8.1,Freddie Thornhill (Sir Ian McKellen) and Stuart Bixby (Sir Derek Jacobi) are an old gay couple who have been together for nearly fifty years. Their lives now revolve around entertaining their frequent guests and hurling insults at each other at every opportunity.,Ian McKellen,Frances de la Tour,Iwan Rheon,NA,8039
Men at Work,(2012–2014),NA,30 min,"Comedy, Drama, Romance",7.1,Comedy following the misadventures of four buddies who work together at a magazine.,Michael Cassidy,Adam Busch,James Lesure,NA,8038
WKRP in Cincinnati,(1978–1982),NA,30 min,Comedy,7.9,"The misadventures of the staff of a struggling Top 40 rock radio station in Cincinnati, Ohio.",Gordon Jump,Loni Anderson,Howard Hesseman,NA,8025
Teenage Bounty Hunters,(2020),NA,18,"Comedy, Crime, Drama",7.7,"After joining forces with a veteran bounty hunter, sixteen-year-old fraternal twin sisters Sterling and Blair dive into the world of bail skipping baddies while still navigating the high stakes of teenage life.",Anjelica Bette Fellini,Kadeem Hardison,Virginia Williams,NA,8010
Fairly Legal,(2011–2012),NA,41 min,"Comedy, Drama",7.3,"A woman, who quit being an attorney at her father's law firm to become a mediator, copes after her father's death.",Michael Trucco,Virginia Williams,Baron Vaughn,NA,7985
Legit,(2013–2014),NA,30 min,Comedy,8.2,Jim and his put upon friends try to learn what it means to be a good person.,Dan Bakkedahl,DJ Qualls,Mindy Sterling,NA,7983
Cuckoo,(II) (2012– ),NA,30 min,Comedy,7.3,"Cuckoo is every parent's worst nightmare - a slacker full of outlandish, New Age ideas.",Helen Baxendale,Tyger Drew-Honey,Kenneth Collard,NA,7983
Bonanza,(1959–1973),NA,49 min,Western,7.3,The Wild West adventures of Ben Cartwright and his sons as they run and defend their Nevada ranch while helping the surrounding community.,Michael Landon,Dan Blocker,Pernell Roberts,NA,7983
The New Tom & Jerry Show,(1975–1977),NA,99 min,"Animation, Family, Comedy",7.8,"A modern continuation of the original Tom and Jerry cartoon, where the cat-and-mouse duo are now close friends through a series of adventures and chaos.",Kathy Gori,Don Messick,Alan Oppenheimer,NA,7970
Tehran,(2020– ),A,45 min,"Drama, Thriller",7.4,A Mossad agent embarks on her first mission as a computer hacker in her home town of Tehran.,Niv Sultan,Shaun Toub,Navid Negahban,Shervin Alenabi,7949
The Riches,(2007–2008),NA,45 min,"Comedy, Crime, Drama",7.8,A family of crooks assume the identity of an upper-middle-class suburban clan in the Deep South.,Minnie Driver,Shannon Woodward,Noel Fisher,NA,7947
Okkupert,(2015– ),18,45 min,"Drama, Thriller",7.7,"In the near future, Norway is occupied by Russia on behalf of the European Union, due to the fact that the newly elected environmental friendly Norwegian government has stopped the all important oil- and gas-production in the North Sea.",Henrik Mestad,Ane Dahl Torp,Eldar Skar,Ingeborga Dapkunaite,7946
Sanditon,(2019),NA,60 min,"Drama, Romance",7.8,"About Charlotte Heywood, a spirited and impulsive woman who moves from her rural home to Sanditon, a fishing village attempting to reinvent itself as a seaside resort.",Kris Marshall,Kate Ashfield,Crystal Clarke,NA,7945
The Neighbors,(2012–2014),NA,30 min,"Comedy, Family, Romance",6.8,A New Jersey family moves to an affluent gated community composed entirely of extraterrestrials.,Lenny Venito,Simon Templeman,Toks Olagundoye,NA,7943
Bionic Woman,(2007),NA,60 min,"Action, Sci-Fi, Thriller",5.7,A reimagining of the popular 1970s TV series about a female athlete who is given bionic strength.,Miguel Ferrer,Molly Price,Lucy Hale,NA,7921
Dirty Money,(2018– ),16,60 min,"Documentary, Crime",8.1,"A Netflix Original Series documenting various stories about exposing the greed, corruption, and crime spreading through the global economy.",Matt Taibbi,Alex Gibney,Anabel Hernández,Fahmi Quadir,7914
"Doogie Howser, M.D.",(1989–1993),NA,30 min,"Comedy, Drama, Family",6.5,"A teenage genius deals with the usual problems of growing up, on top of being a licensed physician in a difficult residency program.",Max Casella,Belinda Montgomery,Lawrence Pressman,NA,7913
Meme Review,(2017– ),NA,NA,"Short, Comedy, Talk-Show",8.7,PewDiePie's critically acclaimed show where he rates and reviews popular memes out of 10 every week.,Felix Kjellberg,Elon Musk,Will Smith,Logan Paul,7911
Penny Dreadful: City of Angels,(2020),NA,18,"Crime, Drama, Fantasy",6,"When a grisly murder shocks Los Angeles in 1938, Detective Tiago Vega and his partner Lewis Michener become embroiled in an epic story that reflects the troubled history of the city.",Daniel Zovatto,Kerry Bishé,Adriana Barraza,NA,7901
Leila,(2019– ),15,48 min,"Drama, Sci-Fi",4.8,"In a near-future world where an oppressive regime segregates society, one woman skirts the system to search for the daughter taken from her years ago.",Huma Qureshi,Rahul Khanna,Siddharth,Leysha Mange,7897
The Tonight Show with Conan O'Brien,(2009–2010),NA,62 min,"Comedy, Music, Talk-Show",8,"Opening monologues, sketches, celebrity interviews, and musical performances are commonly featured.",The Tonight Show Band,Andy Richter,Jerry Vivino,NA,7892
Clannad,(2007–2008),NA,30 min,"Animation, Comedy, Drama",7.9,A high school student who cares little about school or others meets a lonely girl who had to repeat a year while all her friends finished high school. He decides to hang out with her and soon meets more friendly students.,David Matranga,Mai Nakahara,Luci Christian,NA,7890
The Chicago Code,(2011),NA,44 min,"Action, Crime, Drama",7.7,"Detective Jarek Wysocki, one of Chicago's toughest cops, struggles to clean up the town's violence and corruption.",Jennifer Beals,Matt Lauria,Devin Kelley,NA,7873
Sanford and Son,(1972–1977),NA,30 min,Comedy,7.9,The misadventures of a cantankerous junk dealer and his frustrated son.,Demond Wilson,LaWanda Page,Don Bexley,NA,7868
The Practice,(1997–2004),NA,60 min,"Crime, Drama, Mystery",7.7,We follow the exploits and cases of defense attorneys of a Boston law firm. Bobby Donnell is the senior defense attorney and founder of the firm.,Kelli Williams,Lara Flynn Boyle,Steve Harris,NA,7862
Starsky and Hutch,(1975–1979),NA,60 min,"Action, Crime, Drama",7,"Two streetwise cops bust criminals in their red-and-white Ford Gran Torino, with the help of police snitch, Huggy Bear (Antonio Fargas).",Paul Michael Glaser,Antonio Fargas,Bernie Hamilton,NA,7862
"The Adventures of Brisco County, Jr.",(1993–1994),NA,45 min,"Action, Adventure, Comedy",8.3,"A bounty hunter rides the Old West, fighting bad guys, many with futuristic-type gadgets.",Julius Carry,Christian Clemenson,Comet,NA,7861
Bunheads,(2012–2013),NA,44 min,"Comedy, Drama, Family",7.6,"Michelle, a Las Vegas showgirl marries a man on a whim and moves to his sleepy coastal town where she winds up working alongside her new mother-in-law at her dance school.",Kaitlyn Jenkins,Julia Goldani Telles,Bailey De Young,NA,7858
Mad Dogs,(2015–2016),NA,56 min,"Comedy, Crime, Drama",7.5,"A group of guys travel to Belize to see an old friend, when things take an unexpectedly dark turn.",Michael Imperioli,Romany Malco,Steve Zahn,NA,7841
The Gates,(2010),NA,60 min,"Crime, Drama, Fantasy",7.1,"A metropolitan police officer becomes chief of police in a gated suburban neighborhood where vampires, werewolves, witches, and other supernatural entities reside.",Frank Grillo,Marisol Nichols,Luke Mably,NA,7835
Black Clover,(2017– ),13,30 min,"Animation, Action, Adventure",8.1,"Asta and Yuno were abandoned together at the same church and have been inseparable since. As children, they promised that they would compete against each other to see who would become the next Emperor Magus.",Dallas Reid,Cris George,Jill Harris,Micah Solusod,7828
American Housewife,(2016– ),NA,30 min,Comedy,7.3,"A family comedy narrated by Katie, a strong-willed mother, raising her flawed family in a wealthy town filled with perfect wives and their perfect offspring.",Diedrich Bader,Daniel DiMaggio,Ali Wong,NA,7814
Day Break,(2006–2007),NA,60 min,"Action, Drama, Sci-Fi",8,Today Detective Brett Hopper will be accused of shooting state attorney Alberto Garza. He will offer his rock solid alibi. He will realize he's been framed. And he will run. Then he will wake up and start the day over again.,Moon Bloodgood,Victoria Pratt,Meta Golding,NA,7813
Firefly Lane,(2021– ),NA,18,"Drama, Romance",7.6,Tully and Kate support each other through good times and bad with an unbreakable bond that carries them from their teens to their forties.,Sarah Chalke,Ben Lawson,Ali Skovbye,NA,7797
Mind Your Language,(1977–1986),NA,30 min,Comedy,8.7,A diverse group of immigrants and foreigners learn English at an adult education school in London.,George Camiller,Jacki Harding,Zara Nutley,NA,7796
The Apprentice,(2004–2017),NA,60 min,"Game-Show, Reality-TV",4.9,Contestants compete for a job as an apprentice to billionaire American Donald Trump.,Kendra Todd,Tana Goertz,Ivanka Trump,NA,7790
Buck Rogers in the 25th Century,(1979–1981),NA,60 min,"Action, Adventure, Sci-Fi",6.9,A 20th-century astronaut emerges out of 500 years of suspended animation into a future time to become Earth's greatest hero.,Erin Gray,Felix Silla,Mel Blanc,NA,7789
The Jeffersons,(1975–1985),NA,30 min,Comedy,7.4,"A nouveau riche, African-American family who move into a luxury apartment building develop close, if occasionally fractious, relationships with other tenants.",Sherman Hemsley,Marla Gibbs,Roxie Roker,NA,7785
Goof Troop,(1992–1993),NA,30 min,"Animation, Adventure, Comedy",6.8,"The classic Disney character Goofy is a single father raising his son, Max, in Spoonerville. Pete, a frequent antagonist from the old cartoons, lives next door with his family.",April Winchell,Jim Cummings,Bill Farmer,NA,7784
Betaal,(2020– ),18,46 min,"Action, Horror, Thriller",5.3,A remote village becomes the arena of a breathless battle when an undead East India Company officer and his battalion of zombie redcoats attack a squad of modern-day soldiers.,Vineet Kumar Singh,Aahana Kumra,Suchitra Pillai,Jatin Goswami,7777
Punk'd,(2003–2015),NA,30 min,"Comedy, Reality-TV",5.9,A Hidden Camera Show similar to Candid Camera but famous celebrities are the victims. Each week Ashton and his crew of pranksters play a joke on celebrities such as Justin Timberlake and Frankie Muniz.,Brian Fitzpatrick,Andrew Santino,Jason Goldberg,NA,7774
Manhattan,(2014–2015),18,55 min,"Drama, History, War",7.8,"In 1943, in Los Alamos, New Mexico, a team of government scientists is working on the top secret Manhattan Project in a race to produce an atomic bomb before the Nazis. Meanwhile, their families adjust to a life on the military base.",Rachel Brosnahan,Michael Chernus,Christopher Denham,Katja Herbers,7748
Too Hot to Handle,(2020– ),18,40 min,"Game-Show, Reality-TV, Romance",4.5,"On the shores of paradise, gorgeous singles meet and mingle. But there's a twist. To win a $100,000 grand prize, they'll have to give up sex.",Chloe Veitch,David Birtwistle,Francesca Farago,Harry Jowsey,7747
Zone Blanche,(2017– ),18,52 min,"Crime, Drama, Horror",7.5,A police chief and an eccentric new prosecutor investigate a string of grisly crimes and eerie phenomena in an isolated town at the edge of a forest.,Suliane Brahim,Hubert Delattre,Laurent Capelluto,Samuel Jouy,7741
Deadliest Catch,(2005– ),NA,55 min,"Documentary, Adventure, Reality-TV",7.8,A documentary series chronicling the real-life high-sea adventures of the Alaskan crab fishermen. This is the most deadly profession in the world.,Sig Hansen,Keith Colburn,Jake Anderson,NA,7739
The Listener,(2009–2014),NA,42 min,"Crime, Drama, Fantasy",6.8,A young paramedic discovers he has telepathic powers.,Ennis Esmer,Lauren Lee Smith,Rainbow Sun Francks,NA,7716
TRON: Uprising,(2012–2013),PG,30 min,"Animation, Action, Adventure",8.2,"In the computer world of the Grid, a young program joins Tron's fight against their world's tyranny.",Elijah Wood,Tricia Helfer,Charlie Bean,Elizabeth Ho,7709
Car Masters: Rust to Riches,(2018– ),NA,40 min,Reality-TV,8.8,"The colorful crew at Gotham Garage overhauls an eclectic collection of cars and trucks, trading up to a showstopper they can sell for big bucks.",Shawn Pilot,Michael 'Caveman' Pyle,Tony Quinones,NA,7703
Martin,(1992–1997),NA,30 min,"Comedy, Drama, Romance",7.4,"Sassy sitcom centering on radio and television personality Martin Payne. Series focuses on his romantic relationship with girlfriend Gina, her best friend Pam and escapades with best friends Tommy and Cole.",Tisha Campbell-Martin,Thomas Mikal Ford,Carl Anthony Payne II,NA,7694
Batman: The Brave and the Bold,(2008–2011),NA,30 min,"Animation, Action, Adventure",7.3,An updated animated series centering on the Caped Crusader himself as he partners and deals with his fellow superheroes in the DC Comics universe.,John DiMaggio,James Arnold Taylor,Dee Bradley Baker,NA,7693
Come Fly with Me,(2010–2011),NA,29 min,Comedy,7.5,The Little Britain team parodies the various types of characters associated with life in a major British airport. That includes flight and ground staff from regular - and low budget ...                See full summary »,David Walliams,Lindsay Duncan,Sally Rogers,NA,7690
Spawn,(1997–1999),NA,30 min,"Animation, Action, Adventure",8.1,"After being betrayed and murdered by his employer, a government trained assassin named, Al Simmons, is resurrected as a Hellspawn and is forced to become the reluctant leader of Hell's army.",Richard Dysart,Dominique Jennings,Todd McFarlane,NA,7688
Masterchef,(II) (2010– ),NA,42 min,"Game-Show, Reality-TV",7.3,"A nationwide search for the best home cooks in America. One of 50 hopefuls will become a culinary star and one of America's ""Masterchefs.""",Joe Bastianich,Charlie Ryan,Graham Elliot,NA,7681
Chewing Gum,(2015–2017),NA,23 min,Comedy,7.7,"The life of Tracey and the mishaps of her neighbourhood, friends and family, and of course, her boyfriend.",Danielle Walters,Robert Lonsdale,Shola Adewusi,NA,7679
Voltron: Legendary Defender,(2016–2018),NA,23 min,"Animation, Action, Adventure",8.1,Five teenagers become the last line of defense for the galaxy in an intergalactic battle against the evil alien force led by King Zarkon.,Bex Taylor-Klaus,Tyler Labine,Kimberly Brooks,NA,7664
Togetherness,(2015–2016),NA,30 min,"Comedy, Drama, Romance",7.5,Follows two couples living under the same roof who struggle to keep their relationships alive while pursuing their individual dreams.,Melanie Lynskey,Amanda Peet,Steve Zissis,NA,7656
The Tunnel,(2013–2018),NA,60 min,"Crime, Drama, Mystery",7.9,"A prominent French politician is found dead on the border between the U.K. and France, and two agents have to work together on behalf of their respective countries to find the murderer.",Clémence Poésy,Cédric Vieira,Angel Coulby,NA,7634
John Doe,(2002–2003),NA,60 min,"Drama, Mystery, Sci-Fi",7.8,A man who seems to know everything but his own name helps police solve crimes as he searches for his identity.,Jayne Brook,John Marshall Jones,William Forsythe,NA,7633
NOS4A2,(2019–2020),NA,60 min,"Drama, Fantasy, Horror",6.7,"Charlie Manx, a seductive immortal who feeds off the souls of children, has his whole world threatened when a young woman in New England discovers she has a dangerous gift.",Ólafur Darri Ólafsson,Jahkara Smith,Ebon Moss-Bachrach,NA,7617
EastEnders,(1985– ),NA,30 min,"Crime, Drama, Romance",4.7,"The everyday lives of working-class inhabitants of Albert Square, a traditional Victorian square of terrace houses surrounding a park in the East End of London's Walford borough. The square includes the Queen Vic pub and a street market.",Steve McFadden,Pam St. Clement,June Brown,NA,7617
Stromberg,(2004–2012),NA,25 min,Comedy,8.3,A comedy centered around the incompetent boss of a German insurance office.,Oliver Wnuk,Bjarne Mädel,Diana Staehly,NA,7598
Mister Rogers' Neighborhood,(1968–2001),NA,30 min,"Family, Fantasy, Music",8.6,"Fred Rogers explores various topics for young viewers through presentations and music, both in his world and in the Neighborhood of Make-Believe.",Betty Aberlin,David Newell,Joe Negri,NA,7597
Mrs. Brown's Boys,(2011– ),NA,26 min,Comedy,7.2,A comedy centered on a loud-mouthed Irish matriarch whose favorite pastime is meddling in the lives of her six children.,Jennifer Gibney,Eilish O'Carroll,Paddy Houlihan,NA,7586
The Critic,(1994–2001),NA,522 min,"Animation, Comedy, Drama",7.9,Jay Sherman is a New York film critic who has to review films he doesn't like for a living.,Nick Jameson,Maurice LaMarche,Nancy Cartwright,NA,7580
Berlin Station,(2016–2019),NA,60 min,"Drama, Thriller",7.6,Follows a CIA team in Berlin and their clandestine activities.,Michelle Forbes,Mina Tander,Rhys Ifans,NA,7574
Sorjonen,(2016–2020),18,60 min,"Crime, Drama, Mystery",7.6,"Quirky police detective, in Finland, delves into his mind palace to solve despicable crimes all the while trying to keep his family together. If Sherlock was based in Finland this would be it.",Ville Virtanen,Matleena Kuusniemi,Anu Sinisalo,Lenita Susi,7563
Iste Bu Benim Masalim,(2021– ),NA,40 min,"Musical, Romance",1,"She has strong feelings, is dreamer and different from everyone else. Her greatest talent is her voice but she's afraid of the scenes. The rise of a 17-year-old star. How will Aleyna and ...                See full summary »",Cemal Can Canseven,Merve Sevin,Hasan Denizyaran,NA,7560
Rita,(2012–2020),18,40 min,"Comedy, Drama",8.1,"Following the life of a very outspoken and rebellious woman, Rita is a school teacher who is competent in the classroom, but seems to need a teacher of her own, when it comes to her personal life.",Mille Dinesen,Lise Baastrup,Nikolaj Groth,Carsten Bjørnlund,7553
Mock the Week,(2005– ),NA,29 min,"Comedy, Game-Show",7.8,A comedic look at current events.,Hugh Dennis,Andy Parsons,Ed Byrne,NA,7552
Sangsogjadeul,(2013),13,55 min,"Comedy, Drama, Romance",7.5,"After a chance encounter in LA, two teens from different social backgrounds reunite at an exclusive high school attended by Korea's über rich.",Lee Min-Ho,Park Shin-Hye,Kim Woo-Bin,Kim Ji-Won,7548
Outsiders,(I) (2016–2017),NA,60 min,"Crime, Drama",7.5,A story of struggle for power set in the rugged and mysterious hills of Appalachia.,Ryan Hurst,Kyle Gallner,Christina Jackson,NA,7539
Sam & Cat,(2013–2020),NA,30 min,"Comedy, Drama, Family",5.7,A pair of roommates start a baby-sitting service to earn extra cash.,Ariana Grande,Cameron Ocasio,Maree Cheatham,NA,7538
Suzumiya Haruhi no yûutsu,(2006–2009),13,24 min,"Animation, Comedy, Fantasy",7.8,"The crazy adventures of the SOS Brigade, led by the insane but charismatic Haruhi.",Tomokazu Sugita,Aya Hirano,Minori Chihara,Yûko Gotô,7535
Space: Above and Beyond,(1995–1996),NA,60 min,"Action, Adventure, Drama",7.7,"The Earth is embroiled in a desperate war against alien invaders, and this series focuses on one squadron of Marine pilots involved in it.",Kristen Cloke,Rodney Rowland,Joel de la Fuente,NA,7520
The Larry Sanders Show,(1992–1998),NA,30 min,Comedy,8.4,A comedic behind the scenes look at a late night talk show.,Jeffrey Tambor,Wallace Langham,Rip Torn,NA,7516
Good Witch,(2015– ),7,48 min,"Comedy, Drama, Fantasy",7.3,"""Good Witch"" will take viewers on a new magical journey with Cassie Nightingale and her daughter Grace. When Dr. Sam Radford moves in next door to Grey House with his son, they are charmed by the 'magical' mother-daughter duo.",Catherine Bell,Catherine Disher,James Denton,Kylee Evans,7502
Remington Steele,(1982–1987),NA,60 min,"Action, Adventure, Comedy",7.2,The cases of a female private detective partnered with a former thief who assumes the role of a fictitious detective in the business.,Pierce Brosnan,Doris Roberts,James Read,NA,7493
Bad Blood,(2017– ),16,47 min,"Crime, Drama",7.5,A dramatization of the life and death of Montreal mob boss Vito Rizzuto.,Kim Coates,Louis Ferreira,Sharon Taylor,Melanie Scrofano,7486
Star Trek: Lower Decks,(2020– ),NA,16,"Animation, Action, Adventure",6.9,"The support crew serving on one of Starfleet's least important ships, the U.S.S. Cerritos, have to keep up with their duties, often while the ship is being rocked by a multitude of sci-fi anomalies.",Jack Quaid,Noël Wells,Eugene Cordero,NA,7485
Kurtlar Vadisi: Pusu,(2007–2016),NA,120 min,"Action, Crime, Drama",6.2,"Valley of the Wolves, the legendary action drama, centers around Polat Alemdar and follows his journey to serve his country by trying to uncover the truth and defeating the secret enemies ...                See full summary »",Erhan Ufak,Cahit Kayaoglu,Adnan Erdogan,NA,7464
Hill Street Blues,(1981–1987),NA,60 min,"Crime, Drama, Mystery",8.1,The lives and work of the staff of an inner city police precinct.,Michael Warren,Bruce Weitz,James Sikking,NA,7460
