Series_Title,Runtime_of_Series,Certificate,Runtime_of_Episodes,Genre,IMDB_Rating,Overview,Star1,Star2,Star3,Star4,No_of_Votes
Final Space,(2018– ),NA,30 min,"Animation, Action, Adventure",8.3,An astronaut named Gary and his planet-destroying sidekick called Mooncake embark on serialized journeys through space in order to unlock the mystery of where the universe actually ends and if it actually does exist.,Tom Kenny,Olan Rogers,Tika Sumpter,NA,32861
Z Nation,(2014–2018),18,44 min,"Action, Comedy, Drama",6.7,"Three years after the zombie virus has gutted the United States of America a team of everyday heroes must transport the only known survivor of the plague from New York to California, where the last functioning viral lab waits for his blood.",Russell Hodgkinson,Nat Zang,Keith Allan,Kellita Smith,32838
The Suite Life of Zack & Cody,(2005–2008),PG,30 min,"Comedy, Family",6.5,Comedy about identical twins living at the Tipton Hotel with their single mother who is a lounge singer at the hotel.,Cole Sprouse,Dylan Sprouse,Brenda Song,Ashley Tisdale,32762
Red Dwarf,(1988– ),NA,30 min,"Adventure, Comedy, Sci-Fi",8.4,"The adventures of the last human alive and his friends, stranded three million years into deep space on the mining ship Red Dwarf.",Craig Charles,Danny John-Jules,Robert Llewellyn,NA,32633
Life,(I) (2007–2009),13,45 min,"Crime, Drama, Mystery",8.3,A former police officer returns to the force after having been wrongly imprisoned for years.,Damian Lewis,Sarah Shahi,Adam Arkin,Brent Sexton,32564
Blue Bloods,(2010– ),NA,43 min,"Crime, Drama, Mystery",7.6,Revolves around a family of New York cops.,Bridget Moynahan,Will Estes,Len Cariou,NA,32512
Top of the Lake,(2013–2017),NA,60 min,"Crime, Drama, Mystery",7.5,"Obsessed with the disappearance of a 12-year-old pregnant girl near a freezing lake in New Zealand, a brave detective will find herself up against small-town secrets and a side of herself that was meticulously kept at bay.",David Wenham,Peter Mullan,Thomas M. Wright,NA,32355
Batwoman,(2019– ),NA,45 min,"Action, Adventure, Crime",3.4,Batwoman seeks justice for Gotham City.,Rachel Skarsten,Meagan Tandy,Nicole Kang,NA,32304
Saved by the Bell,(1989–1992),NA,30 min,"Comedy, Family, Romance",7,"A close-knit group of six friends get through their teens together while attending Bayside High School in Palisades, California.",Mario Lopez,Dustin Diamond,Lark Voorhies,NA,32241
The Filthy Frank Show,(2011–2017),NA,12 min,"Comedy, Fantasy, Music",9.5,Filthy Frank and his disease ridden friends talk about various topics and take part in multiple life-threatening shenanigans.,Artemis Holdenberry,Zeeq,Bloody Hairy,NA,32155
Safe,(2018),18,60 min,"Crime, Drama, Mystery",7.3,"After his teenage daughter goes missing, a widowed surgeon begins uncovering dark secrets of the people closest to him.",Michael C. Hall,Amy James-Kelly,Amanda Abbington,Freddie Thorp,32141
Yellowstone,(2018– ),NA,60 min,"Drama, Western",8.6,A ranching family in Montana faces off against others encroaching on their land.,Luke Grimes,Kelly Reilly,Wes Bentley,NA,32071
Good Girls,(2018– ),16,43 min,"Comedy, Crime, Drama",7.8,Three suburban mothers suddenly find themselves in desperate circumstances and decide to stop playing it safe and risk everything to take their power back.,Christina Hendricks,Retta,Mae Whitman,Reno Wilson,32012
Rugrats,(1990–2006),NA,30 min,"Animation, Adventure, Comedy",7.4,The cartoon misadventures of four babies and their snotty older cousin as they face the things in life they don't understand.,Christine Cavanaugh,Nancy Cartwright,Kath Soucie,NA,31985
Law & Order,(1990–2010),NA,45 min,"Crime, Drama, Mystery",7.7,"Follows a crime (usually a murder), usually adapted from current headlines, from two separate vantage points, the police investigation and the prosecution in court.",Jesse L. Martin,Dennis Farina,S. Epatha Merkerson,NA,31923
Young Justice,(2010– ),NA,23 min,"Animation, Action, Adventure",8.6,Teenage superheroes strive to prove themselves as members of the Justice League.,Danica McKellar,Nolan North,Khary Payton,NA,31763
The Golden Girls,(1985–1992),NA,30 min,"Comedy, Drama",7.9,"Four previously married women live together in Miami, sharing their various experiences together and enjoying themselves despite hard times.",Betty White,Rue McClanahan,Estelle Getty,NA,31741
Rules of Engagement,(2007–2013),NA,22 min,"Comedy, Romance",7.3,"Two couples and their single friend, all at different stages in their relationships, deal with the complications of dating, commitment, and marriage.",Megyn Price,Oliver Hudson,Bianca Kajlich,NA,31659
ALF,(1986–1990),NA,30 min,"Comedy, Family, Sci-Fi",7.4,A furry alien wiseguy comes to live with the Tanner family after crashing into their garage.,Paul Fusco,Max Wright,Anne Schedeen,NA,31650
The Protector,(2018–2020),18,40 min,"Action, Fantasy, Sci-Fi",6.7,"Discovering his ties to a secret ancient order, a young man living in modern Istanbul embarks on a quest to save the city from an immortal enemy.",Çagatay Ulusoy,Hazar Ergüçlü,Okan Yalabik,Burçin Terzioglu,31626
Shooter,(2016–2018),16,60 min,"Action, Drama",7.5,"A conspiracy thriller that follows the journey of Bob Lee Swagger, a highly-decorated veteran who is coaxed back into action to prevent a plot to kill the President.",Ryan Phillippe,Shantel VanSanten,Cynthia Addai-Robinson,Omar Epps,31577
Bored to Death,(2009–2011),NA,28 min,"Comedy, Crime, Drama",7.9,A well-meaning but struggling writer decides to lead a sort of double life by pretending to be a private detective using the methods he read about in old detective novels.,Zach Galifianakis,Ted Danson,Heather Burns,NA,31553
The Goldbergs,(2013– ),NA,22 min,Comedy,8.1,"This ABC show takes place in Jenkintown, Pennsylvania in the 1980s and follows the lives of a family named The Goldbergs.",Sean Giambrone,Troy Gentile,Hayley Orrantia,NA,31495
The Cosby Show,(1984–1992),NA,30 min,"Comedy, Family, Romance",7.3,The goings-on in the life of a successful African-American family.,Phylicia Rashad,Keshia Knight Pulliam,Malcolm-Jamal Warner,NA,31422
The Family Man,(2019– ),16+,45 min,"Action, Comedy, Drama",8.5,"A working man from the National Investigation Agency tries to protect the nation from terrorism, but he also needs to keep his family safe from his secret job.",Manoj Bajpayee,Samantha Ruth Prabhu,Priyamani,Sharib Hashmi,31390
"Beverly Hills, 90210",(1990–2000),NA,44 min,"Drama, Romance",6.4,"A group of friends living in Beverly Hills, California make their way through life from their school days into adulthood.",Shannen Doherty,Luke Perry,Jennie Garth,NA,31373
A Discovery of Witches,(2018– ),15+,60 min,"Drama, Fantasy, Romance",8,"Diana Bishop, historian and witch, accesses Ashmole 782 and knows she must solve its mysteries. She is offered help by the enigmatic Matthew Clairmont, but he's a vampire and witches should never trust vampires.",Matthew Goode,Teresa Palmer,Valarie Pettiford,Alex Kingston,31305
The Bugs Bunny Show,(1960–1975),NA,30 min,"Animation, Comedy",8.6,TV series featuring the classic Looney Tunes animated shorts.,June Foray,Jim Backus,Bea Benaderet,NA,31238
Star Wars: Rebels,(2014–2018),NA,22 min,"Animation, Action, Adventure",8,A brave and clever ragtag starship crew stands up against the evil Empire as it tightens its grip on the galaxy and hunts down the last of the Jedi Knights.,Dave Filoni,Vanessa Marshall,Freddie Prinze Jr.,NA,31235
The Gifted,(2017–2019),12+,43 min,"Action, Drama, Fantasy",7.3,"In a world where mutated humans are treated with distrust and fear, an institute for mutants battles to achieve peaceful co-existence with humanity.",Stephen Moyer,Amy Acker,Sean Teale,Natalie Alyn Lind,31191
Hunters,(2020– ),18,60 min,"Crime, Drama, Mystery",7.2,"In 1977, in New York City, a troubled young Jewish man bent on revenge is taken in by a secret group of Nazi hunters fighting a clandestine war against the cabal of high-ranking Nazi officials in hiding who work to create the Fourth Reich.",Al Pacino,Logan Lerman,Lena Olin,Jerrika Hinton,31074
The Rain,(2018–2020),18,45 min,"Drama, Sci-Fi, Thriller",6.3,"After a brutal virus wipes out most of the population, two young siblings embark on a perilous search for safety.",Alba August,Lucas Lynggaard Tønnesen,Mikkel Boe Følsgaard,Lukas Løkken,30924
Parenthood,(2010–2015),NA,60 min,"Comedy, Drama",8.2,The lives and tragedies of the Braverman family tree.,Lauren Graham,Dax Shepard,Monica Potter,NA,30845
Dark Angel,(2000–2002),NA,60 min,"Action, Drama, Mystery",7.4,"A group of genetically-enhanced children escape from a lab project. Years later we meet Max, one of the escapees who now works for a messenger service in the post-apocalyptic Pacific Northwest.",Michael Weatherly,Richard Gunn,J.C. MacKenzie,NA,30802
Teenage Mutant Ninja Turtles,(1987–1996),NA,23 min,"Animation, Action, Adventure",7.9,The adventures of a quartet of humanoid warrior turtles and their friends.,Barry Gordon,Rob Paulsen,Townsend Coleman,NA,30774
Hey Arnold!,(1996–2004),NA,15 min,"Animation, Comedy, Drama",7.6,"The everyday life of Arnold, a fourth-grader in a nameless city that resembles Brooklyn, New York, who lives in a multi-racial boarding house with his grandparents and a motley assortment of friends and neighbors.",Jamil Walker Smith,Dan Castellaneta,Justin Shenkarow,NA,30705
Ally McBeal,(1997–2002),NA,45 min,"Comedy, Drama, Fantasy",6.8,Follows the personal and professional life of lawyer Ally.,Greg Germann,Jane Krakowski,Vonda Shepard,NA,30626
Suburgatory,(2011–2014),NA,22 min,Comedy,7.2,"Tessa Altman is used to the big city but when her dad moves her away, she has to adapt to her new suburban life in Chatswin.",Jane Levy,Carly Chaikin,Allie Grant,NA,30556
Colony,(2016–2018),16,42 min,"Action, Adventure, Drama",7.4,"In the wake of a mysterious alien invasion, a family fights to stay together in a new world order.",Josh Holloway,Sarah Wayne Callies,Peter Jacobson,Tory Kittles,30482
Sneaky Pete,(2015–2019),18,60 min,Crime,8.1,"A con man on the run from a vicious gangster takes cover by assuming the identity of his prison cellmate, Pete, reuniting with his estranged family, that threatens to drag him into a world just as dangerous as the one he's escaping.",Giovanni Ribisi,Marin Ireland,Shane McRae,Libe Barer,30440
Knight Rider,(1982–1986),NA,46 min,"Action, Crime, Drama",6.9,A lone crimefighter battles the forces of evil with the help of a virtually indestructible and artificially intelligent supercar.,Edward Mulhare,Richard Basehart,Patricia McPherson,NA,30279
"Scooby Doo, Where Are You!",(1969–1970),NA,22 min,"Animation, Adventure, Comedy",7.9,"A group of teenage friends and their Great Dane (Scooby-Doo) travel in a bright green van solving strange and hilarious mysteries, while returning from or going to a regular teenage function.",Casey Kasem,Nicole Jaffe,Vic Perrin,NA,30191
An Idiot Abroad,(2010–2012),NA,43 min,"Documentary, Adventure, Comedy",8.3,"Brit Karl Pilkington has led a sheltered life. Not having done any traveling, he enjoys living within the comforts of what he knows, basically that being what is purely British. As such, ...                See full summary »",Ricky Gervais,Stephen Merchant,Luke Campbell,NA,30121
Kingdom,(2019– ),18,45 min,"Action, Drama, Horror",8.4,"While strange rumors about their ill King grip a kingdom, the crown prince becomes their only hope against a mysterious plague overtaking the land.",Ju Ji-Hoon,Bae Doona,Kim Sungkyu,Hye-jun Kim,30062
Regular Show,(2009–2017),NA,23 min,"Animation, Short, Action",8.4,The daily surreal adventures of a blue jay and raccoon duo that attempt to deal with their mundane jobs as groundskeepers at the local park.,William Salyers,Sam Marin,Mark Hamill,NA,30012
Anger Management,(2012–2014),18,22 min,"Comedy, Romance",6.6,"Ex baseball player Charlie is an anger management therapist with small group sessions at home. He has an OCD teen daughter, an ex-wife and a sex buddy/therapist.",Charlie Sheen,Shawnee Smith,Noureen DeWulf,Michael Arden,29957
Rizzoli & Isles,(2010–2016),16,60 min,"Crime, Drama, Mystery",7.6,Detective Jane Rizzoli and Chief Medical Examiner Dr. Maura Isles team up to solve crimes in Boston.,Angie Harmon,Sasha Alexander,Jordan Bridges,Bruce McGill,29866
Gomorra: La serie,(2014– ),NA,55 min,"Crime, Drama, Thriller",8.7,Ciro disregards tradition in his attempt to become the next boss of his crime syndicate. The internal power struggle puts him and his entire family's life at risk.,Marco D'Amore,Cristiana Dell'Anna,Fortunato Cerlino,NA,29783
Wizards of Waverly Place,(2007–2012),All,22 min,"Adventure, Comedy, Drama",6.9,"The Russo family may be an ordinary family with an average restaurant, but behind close doors, all three children must compete to be the next family wizard.",Selena Gomez,David Henrie,Jake T. Austin,Jennifer Stone,29638
QI,(2003– ),NA,30 min,"Comedy, Game-Show",8.6,"A comedy panel game in which being Quite Interesting is more important than being right. Sandi Toksvig is joined each week by four comedians to share anecdotes and trivia, and maybe answer some questions as well.",Stephen Fry,Sandi Toksvig,Phill Jupitus,NA,29604
Last Man Standing,(2011–2021),12+,30 min,Comedy,7.6,A married father of three tries to maintain his manliness in a world increasingly dominated by women.,Tim Allen,Nancy Travis,Hector Elizondo,Christoph Sanders,29526
F Is for Family,(2015– ),18,30 min,"Animation, Comedy, Drama",8,"Follow the Murphy family back to the 1970s, when kids roamed wild, beer flowed freely and nothing came between a man and his TV.",Bill Burr,Laura Dern,Justin Long,Debi Derryberry,29446
DuckTales,(1987–1990),NA,23 min,"Animation, Adventure, Comedy",8.1,The globe-trotting treasure-hunting money-making adventures of billionaire Scrooge McDuck and his nephews.,Russi Taylor,Terence McGovern,Chuck McCann,NA,29445
Strike Back,(2010–2020),NA,45 min,"Action, Drama, Thriller",8.2,"Follows the actions of Section 20, a secretive unit of British military intelligence. A team of special operations personnel conduct several high risk missions across the globe.",Sullivan Stapleton,Michelle Lukes,Daniel MacPherson,NA,29347
Longmire,(2012–2017),NA,60 min,"Action, Crime, Drama",8.3,"Walt Longmire is the dedicated and unflappable sheriff of Absaroka County, Wyoming. Widowed only a year, he is a man in psychic repair but buries his pain behind his brave face, unassuming grin and dry wit.",Katee Sackhoff,Lou Diamond Phillips,Cassidy Freeman,NA,29313
Lovecraft Country,(2020– ),18,60 min,"Drama, Fantasy, Horror",7.1,A young African-American travels across the U.S. in the 1950s in search of his missing father.,Jonathan Majors,Jurnee Smollett,Courtney B. Vance,Michael Kenneth Williams,29041
Kenpû Denki Berserk,(1997–1998),NA,23 min,"Animation, Action, Adventure",8.7,"Guts is a skilled swordsman who joins forces with a mercenary group named 'The Band of the Hawk', lead by the charismatic Griffith, and fights with them as they battle their way into the royal court.",Marc Diraison,Carrie Keranen,Kevin T. Collins,NA,28987
Life on Mars,(2006–2007),NA,60 min,"Crime, Drama, Mystery",8.3,"After being involved in a car accident in 2006, DCI Sam Tyler wakes up to find himself in 1973, the era of 'Sweeney' type policing, Mark III Cortinas, and flared trousers.",Philip Glenister,Liz White,Dean Andrews,NA,28896
Lost Girl,(2010–2016),NA,44 min,"Action, Drama, Fantasy",7.7,Bo is a supernatural being who challenges her clan's way of life.,Kris Holden-Ried,Zoie Palmer,Rick Howland,NA,28705
The Mindy Project,(2012–2017),16,30 min,Comedy,7.4,"A young Ob/Gyn doctor balances her personal and professional life, surrounded by quirky co-workers in a small office.",Mindy Kaling,Ike Barinholtz,Ed Weeks,Chris Messina,28619
Halt and Catch Fire,(2014–2017),NA,60 min,Drama,8.4,Follows some players in the 80s technological revolution that lead to information society.,Scoot McNairy,Mackenzie Davis,Kerry Bishé,NA,28578
Mom,(2013–2021),16+,30 min,"Comedy, Drama, Romance",7.2,A newly sober single mom tries to pull her life together in Napa Valley while dealing with her wayward mother.,Allison Janney,Anna Faris,Mimi Kennedy,Beth Hall,28540
Dharma & Greg,(1997–2002),NA,30 min,"Comedy, Romance",6.3,"A free-spirited yoga instructor finds true love in a conservative lawyer and they get married on the first date. Though they are polar opposites, he fulfills her need of stability and she fulfills his need of optimism.",Thomas Gibson,Joel Murray,Mimi Kennedy,NA,28515
Chicago P.D.,(2014– ),NA,43 min,"Action, Crime, Drama",8.1,"Follows District 21 of the Chicago Police Department, which is made up of two distinctly different groups: the uniformed cops and the Intelligence Unit.",Jesse Lee Soffer,Patrick John Flueger,Marina Squerciati,NA,28493
Demon Slayer: Kimetsu No Yaiba,(2019– ),16,25 min,"Animation, Action, Fantasy",8.7,"A family is attacked by demons and only two members survive - Tanjiro and his sister Nezuko, who is turning into a demon slowly. Tanjiro sets out to become a demon slayer to avenge his family and cure his sister.",Natsuki Hanae,Zach Aguilar,Abby Trott,Aleks Le,28442
Derek,(2012–2014),NA,23 min,"Comedy, Drama",8,Derek is a loyal nursing home care assistant who sees only the good in his quirky co-workers as they struggle against prejudice and shrinking budgets to care for their elderly residents.,Kerry Godliman,David Earl,Tim Barlow,NA,28354
Columbo,(1971–2003),NA,100 min,"Crime, Drama, Mystery",8.2,Los Angeles homicide detective Lieutenant Columbo uses his humble ways and ingenuous demeanor to winkle out even the most well-concealed of crimes.,Mike Lally,John Finnegan,Bruce Kirby,NA,28285
Helix,(2014–2015),NA,40 min,"Drama, Horror, Mystery",6.8,A team of scientists are thrust into a potentially life-or-death situation when they arrive in the Arctic to secretly investigate what could be an outbreak of a strange disease in a secluded international research facility.,Kyra Zagorsky,Mark Ghanimé,Jordan Hayes,NA,28271
Dirilis: Ertugrul,(2014–2019),16,120 min,"Action, Adventure, Drama",7.9,"The heroic story of Ertugrul Ghazi, the father of Osman (Uthman) who founded the Ottoman Empire.",Engin Altan Düzyatan,Hülya Darcan,Cengiz Coskun,Nurettin Sönmez,28237
Pinky and the Brain,(1995–1998),NA,30 min,"Animation, Comedy, Family",7.9,A genius mouse and his stupid sidekick try to conquer the world each night.,Rob Paulsen,Tress MacNeille,Frank Welker,NA,28204
Skam,(2015–2017),NA,30 min,"Drama, Romance",8.6,"The story of young teenagers and pupils on Hartvig Nissens upper secondary school in Oslo, and their troubles, scandals and everyday life. Each season is told from a different person's point of view.",Iman Meskini,Ulrikke Falch,Lisa Teige,NA,28127
Dracula,(2013–2014),NA,43 min,"Drama, Horror, Romance",7.4,"Dracula travels to London, with dark plans for revenge against those who ruined his life centuries earlier. However, his plan is complicated when he falls in love with a woman who seems to be a reincarnation of his dead wife.",Jessica De Gouw,Thomas Kretschmann,Victoria Smurfit,NA,28097
Babylon 5,(1993–1998),NA,45 min,"Action, Adventure, Drama",8.3,"In the mid 23rd century, the Earth Alliance space station Babylon 5, located in neutral territory, is a major focal point for political intrigue, racial tensions and various wars over the course of five years.",Richard Biggs,Stephen Furst,Andreas Katsulas,NA,28095
Kyle XY,(2006–2009),NA,60 min,"Drama, Mystery, Romance",7.5,"A family takes in a formerly institutionalized teen savant who is missing standard human behaviors such as anger, joy, and love.",Marguerite MacIntyre,Bruce Thomas,April Matson,NA,28045
Kota Factory,(2019),16,45 min,"Comedy, Drama",9,"Dedicated to Shrimati SL Loney ji, Shri Irodov ji and Maanniya HC Verma ji, 'Kota Factory' is TVF's latest original. India's first 'Black and White' show highlights the problems present day IIT-JEE aspirants face in their day-to-day lives.",Mayur More,Jitendra Kumar,Ranjan Raj,Revathi Pillai,28043
Damages,(2007–2012),18,60 min,"Crime, Drama, Mystery",8.1,A law school graduate becomes the protégée of a successful high-stakes litigator.,Glenn Close,Rose Byrne,Tate Donovan,Zachary Booth,27960
Snowpiercer,(2020– ),18,60 min,"Action, Drama, Sci-Fi",6.8,"Seven years after the world has become a frozen wasteland, the remnants of humanity inhabit a perpetually-moving train that circles the globe, where class warfare, social injustice and the politics of survival play out.",Daveed Diggs,Mickey Sumner,Alison Wright,Jennifer Connelly,27822
Party Down,(2009–2010),NA,30 min,"Comedy, Drama",8.2,"A group of actors move to Los Angeles to make it big, but end up working as caterers.",Ken Marino,Ryan Hansen,Martin Starr,NA,27770
Beavis and Butt-Head,(1993–2011),NA,15 min,"Animation, Comedy, Music",7.5,"Animated MTV series about two teenage heavy-metal music fans who occasionally do idiotic things because they're bored. For them, everything is ""cool"" or ""sucks.""",Dale Revo,Kristofor Brown,Tracy Grandstaff,NA,27721
Alphas,(2011–2012),NA,44 min,"Action, Drama, Sci-Fi",7.2,Alphas is a science fiction drama focusing on a team that investigates people with supernatural abilities.,Ryan Cartwright,Warren Christie,Azita Ghanizada,NA,27690
Hercules: The Legendary Journeys,(1995–1999),NA,44 min,"Action, Adventure, Drama",6.5,"Hercules, aided by his best friend Iolaus, goes on many adventures helping people and slaying mythical monsters using his half-god strength.",Michael Hurst,Kevin Smith,Robert Trebor,NA,27600
Behzat Ç.: Bir Ankara Polisiyesi,(2010–2019),NA,90 min,"Crime, Drama, Mystery",8.8,"Centered around a personally troubled, officially discredited police chief and his inharmonious police team in Ankara Police Force. Even though the show usually focuses on murders and other...                See full summary »",Inanç Konukçu,Ege Aydan,Berkan Sal,NA,27331
Ezel,(2009–2011),NA,90 min,"Crime, Drama, Thriller",8.6,"Betrayed by his trusted friends and the woman he loved, Ömer Uçar returns as Ezel to exact his vengeance.",Cansu Dere,Yigit Özsener,Baris Falay,NA,27255
Roswell,(1999–2002),NA,42 min,"Drama, Mystery, Sci-Fi",7.5,The lives of three young alien/human hybrids with extraordinary gifts in Roswell.,Jason Behr,Katherine Heigl,Majandra Delfino,NA,27254
American Vandal,(2017–2018),18,34 min,"Comedy, Crime, Drama",8.2,A true-crime satire that explores the aftermath of a costly high school prank that left twenty-seven faculty cars vandalized with phallic images.,Tyler Alvarez,Griffin Gluck,Jimmy Tatro,Travis Tope,26857
Spider-Man,(1994–1998),PG,23 min,"Animation, Action, Adventure",8.4,A young man with spider-like abilities fights crime as a superhero in New York City while trying to have a normal personal life.,Christopher Daniel Barnes,Sara Ballantine,Edward Asner,Roscoe Lee Browne,26793
Broad City,(2014–2019),NA,22 min,Comedy,8.4,"Broad City follows two women throughout their daily lives in New York City, making the smallest and mundane events hysterical and disturbing to watch all at the same time.",Abbi Jacobson,Hannibal Buress,Arturo Castro,NA,26775
Covert Affairs,(2010–2014),13,60 min,"Action, Crime, Drama",7.3,"Fresh out of the farm, Annie Walker must adapt to the challenging life of a CIA operative under the guidance of her handler, Auggie. But soon she realizes her recruit might have to do with her last boyfriend rather than her talent.",Piper Perabo,Christopher Gorham,Kari Matchett,Peter Gallagher,26766
The Boondocks,(2005–2014),NA,22 min,"Animation, Action, Comedy",8.4,"Adventures of two boys, Riley and Huey Freeman, who undergo a culture clash when they move from Chicago to the suburbs to live with their grandfather.",John Witherspoon,Gary Anthony Williams,Cedric Yarbrough,NA,26758
Keeping Up with the Kardashians,(2006– ),16,44 min,"Drama, Family, Reality-TV",2.8,"A peek inside the exploits and privileged private lives of the blended Kardashian-Jenner family, including sisters Kim, Kourtney, Khloé, Kendall and Kylie.",Khloé Kardashian,Kim Kardashian West,Kourtney Kardashian,Kris Jenner,26601
Lilyhammer,(2012–2014),NA,45 min,"Comedy, Crime, Drama",8,A New York mobster goes into hiding in rural Lillehammer in Norway after testifying against his former associates.,Trond Fausa,Steinar Sagen,Marian Saastad Ottesen,NA,26595
Panchayat,(2020– ),16,35 min,"Comedy, Drama",8.7,"A comedy-drama, which captures the journey of an engineering graduate Abhishek, who for lack of a better job option joins as secretary of a Panchayat office in a remote village of Uttar Pradesh.",Jitendra Kumar,Raghuvir Yadav,Chandan Roy,Faisal Malik,26587
Spin City,(1996–2002),NA,30 min,Comedy,7.3,"Mike Flaherty, the Deputy Mayor of New York City, and his team of half-wits must constantly save the Mayor from embarrassment and the media. Mike is later succeeded by Charlie Crawford.",Charlie Sheen,Heather Locklear,Richard Kind,NA,26507
Teen Titans,(2003–2006),NA,30 min,"Animation, Action, Adventure",7.8,A team of five teenaged superheroes save the world from many villains around their city while experiencing things normal teens face today.,Greg Cipes,Scott Menville,Khary Payton,NA,26467
Asur: Welcome to Your Dark Side,(2020– ),18,43 min,"Crime, Drama, Mystery",8.4,"A unique crime thriller that pits two opposing worlds against each other. The less explored, intricate world of forensic science and the deep mysticism of ancient Indian Mythology.",Arshad Warsi,Barun Sobti,Riddhi Dogra,Anupriya Goenka,26350
